Script started on 2023-09-24 15:05:54+03:00 [TERM="xterm-256color" TTY="/dev/pts/2" COLUMNS="124" LINES="42"]
[?2004h]0;zoid@dll: ~/projects/otus/2023-04-linux/35[01;32mzoid@dll[00m:[01;34m~/projects/otus/2023-04-linux/35[00m$ cat Vagrantfile 
[?2004l# -*- mode: ruby -*-
# vi: set ft=ruby :

Vagrant.configure(2) do |config|
  config.vm.box = "centos/7"

  config.vm.provision "ansible" do |ansible|
    # ansible.verbose = "vvv"
    ansible.playbook = "provisioning/playbook.yml"
    # ansible.playbook = "provisioning2/playbook.yml"
    ansible.become = "true"
  end


  config.vm.provider "virtualbox" do |v|
	  v.memory = 256
  end

  config.vm.define "ns01" do |ns01|
    ns01.vm.network "private_network", ip: "192.168.50.10", virtualbox__intnet: "dns"
    ns01.vm.hostname = "ns01"
  end

  config.vm.define "ns02" do |ns02|
    ns02.vm.network "private_network", ip: "192.168.50.11", virtualbox__intnet: "dns"
    ns02.vm.hostname = "ns02"
  end

  config.vm.define "client" do |client|
    client.vm.network "private_network", ip: "192.168.50.15", virtualbox__intnet: "dns"
    client.vm.hostname = "client"
  end

  config.vm.define "client2" do |client2|
    client2.vm.network "private_network", ip: "192.168.50.16", virtualbox__intnet: "dns"
    client2.vm.hostname = "client2"
  end
end
[?2004h]0;zoid@dll: ~/projects/otus/2023-04-linux/35[01;32mzoid@dll[00m:[01;34m~/projects/otus/2023-04-linux/35[00m$ vagrant up
[?2004l[0mBringing machine 'ns01' up with 'virtualbox' provider...[0m
[0mBringing machine 'ns02' up with 'virtualbox' provider...[0m
[0mBringing machine 'client' up with 'virtualbox' provider...[0m
[0mBringing machine 'client2' up with 'virtualbox' provider...[0m
[1m==> ns01: Importing base box 'centos/7'...[0m
[0m[K[0m[0mProgress: 20%[0m[0m[K[0m[0mProgress: 40%[0m[0m[K[0m[0mProgress: 70%[0m[0m[K[0m[0mProgress: 90%[0m[0m[K[0m[1m==> ns01: Matching MAC address for NAT networking...[0m
[1m==> ns01: Checking if box 'centos/7' version '2004.01' is up to date...[0m
[1m==> ns01: Setting the name of the VM: 35_ns01_1695557176227_55828[0m
[1m==> ns01: Clearing any previously set network interfaces...[0m
[1m==> ns01: Preparing network interfaces based on configuration...[0m
[0m    ns01: Adapter 1: nat[0m
[0m    ns01: Adapter 2: intnet[0m
[1m==> ns01: Forwarding ports...[0m
[0m    ns01: 22 (guest) => 2222 (host) (adapter 1)[0m
[1m==> ns01: Running 'pre-boot' VM customizations...[0m
[1m==> ns01: Booting VM...[0m
[1m==> ns01: Waiting for machine to boot. This may take a few minutes...[0m
[0m    ns01: SSH address: 127.0.0.1:2222[0m
[0m    ns01: SSH username: vagrant[0m
[0m    ns01: SSH auth method: private key[0m
[0m    ns01: 
    ns01: Vagrant insecure key detected. Vagrant will automatically replace
    ns01: this with a newly generated keypair for better security.[0m
[0m    ns01: 
    ns01: Inserting generated public key within guest...[0m
[0m    ns01: Removing insecure key from the guest if it's present...[0m
[0m    ns01: Key inserted! Disconnecting and reconnecting using new SSH key...[0m
[1m==> ns01: Machine booted and ready![0m
[1m==> ns01: Checking for guest additions in VM...[0m
[0m    ns01: No guest additions were detected on the base box for this VM! Guest
    ns01: additions are required for forwarded ports, shared folders, host only
    ns01: networking, and more. If SSH fails on this machine, please install
    ns01: the guest additions and repackage the box to continue.
    ns01: 
    ns01: This is not an error message; everything may continue to work properly,
    ns01: in which case you may ignore this message.[0m
[1m==> ns01: Setting hostname...[0m
[1m==> ns01: Configuring and enabling network interfaces...[0m
[1m==> ns01: Rsyncing folder: /home/zoid/projects/otus/2023-04-linux/35/ => /vagrant[0m
[1m==> ns01: Running provisioner: ansible...[0m
[0m    ns01: Running ansible-playbook...[0m
[0m
PLAY [all] *********************************************************************
[0m[0m
TASK [Gathering Facts] *********************************************************
[0m[0m[0;32mok: [ns01][0m
[0m[0m
TASK [install packages] ********************************************************
[0m[0m[0;33mchanged: [ns01] => (item=bind)[0m
[0m[0m[0;33mchanged: [ns01] => (item=bind-utils)[0m
[0m[0m[0;33mchanged: [ns01] => (item=ntp)[0m
[0m[0m[0;33mchanged: [ns01] => (item=vim)[0m
[0m[0m
TASK [copy transferkey to all servers and the client] **************************
[0m[0m[0;33mchanged: [ns01][0m
[0m[0m
PLAY [ns01] ********************************************************************
[0m[0m
TASK [Gathering Facts] *********************************************************
[0m[0m[0;32mok: [ns01][0m
[0m[0m
TASK [copy named.conf] *********************************************************
[0m[0m[0;33mchanged: [ns01][0m
[0m[0m
TASK [copy zones] **************************************************************
[0m[0m[0;33mchanged: [ns01] => (item=/home/zoid/projects/otus/2023-04-linux/35/provisioning/named.dns.lab)[0m
[0m[0m[0;33mchanged: [ns01] => (item=/home/zoid/projects/otus/2023-04-linux/35/provisioning/named.ddns.lab)[0m
[0m[0m[0;33mchanged: [ns01] => (item=/home/zoid/projects/otus/2023-04-linux/35/provisioning/named.dns.lab.rev)[0m
[0m[0m[0;33mchanged: [ns01] => (item=/home/zoid/projects/otus/2023-04-linux/35/provisioning/named.newdns.lab)[0m
[0m[0m
TASK [copy resolv.conf to the servers] *****************************************
[0m[0m[0;33mchanged: [ns01][0m
[0m[0m
TASK [set /etc/named permissions] **********************************************
[0m[0m[0;33mchanged: [ns01][0m
[0m[0m
TASK [ensure named is running and enabled] *************************************
[0m[0m[0;33mchanged: [ns01][0m
[0m[0m[1;35m[WARNING]: Could not match supplied host pattern, ignoring: ns02[0m
[0m[0m
PLAY [ns02] ********************************************************************
[0;36mskipping: no hosts matched[0m
[0m[0m[1;35m[WARNING]: Could not match supplied host pattern, ignoring: client[0m
[0m[0m
PLAY [client] ******************************************************************
[0m[0m[0;36mskipping: no hosts matched[0m

PLAY RECAP *********************************************************************
[0;33mns01[0m                       : [0;32mok=9   [0m [0;33mchanged=7   [0m unreachable=0    failed=0    skipped=0    rescued=0    ignored=0   

[0m[1m==> ns02: Importing base box 'centos/7'...[0m
[0m[K[0m[0mProgress: 20%[0m[0m[K[0m[0mProgress: 40%[0m[0m[K[0m[0mProgress: 70%[0m[0m[K[0m[0mProgress: 90%[0m[0m[K[0m[1m==> ns02: Matching MAC address for NAT networking...[0m
[1m==> ns02: Checking if box 'centos/7' version '2004.01' is up to date...[0m
[1m==> ns02: Setting the name of the VM: 35_ns02_1695557293510_95830[0m
[1m==> ns02: Fixed port collision for 22 => 2222. Now on port 2200.[0m
[1m==> ns02: Clearing any previously set network interfaces...[0m
[1m==> ns02: Preparing network interfaces based on configuration...[0m
[0m    ns02: Adapter 1: nat[0m
[0m    ns02: Adapter 2: intnet[0m
[1m==> ns02: Forwarding ports...[0m
[0m    ns02: 22 (guest) => 2200 (host) (adapter 1)[0m
[1m==> ns02: Running 'pre-boot' VM customizations...[0m
[1m==> ns02: Booting VM...[0m
[1m==> ns02: Waiting for machine to boot. This may take a few minutes...[0m
[0m    ns02: SSH address: 127.0.0.1:2200[0m
[0m    ns02: SSH username: vagrant[0m
[0m    ns02: SSH auth method: private key[0m
[0m    ns02: 
    ns02: Vagrant insecure key detected. Vagrant will automatically replace
    ns02: this with a newly generated keypair for better security.[0m
[0m    ns02: 
    ns02: Inserting generated public key within guest...[0m
[0m    ns02: Removing insecure key from the guest if it's present...[0m
[0m    ns02: Key inserted! Disconnecting and reconnecting using new SSH key...[0m
[1m==> ns02: Machine booted and ready![0m
[1m==> ns02: Checking for guest additions in VM...[0m
[0m    ns02: No guest additions were detected on the base box for this VM! Guest
    ns02: additions are required for forwarded ports, shared folders, host only
    ns02: networking, and more. If SSH fails on this machine, please install
    ns02: the guest additions and repackage the box to continue.
    ns02: 
    ns02: This is not an error message; everything may continue to work properly,
    ns02: in which case you may ignore this message.[0m
[1m==> ns02: Setting hostname...[0m
[1m==> ns02: Configuring and enabling network interfaces...[0m
[1m==> ns02: Rsyncing folder: /home/zoid/projects/otus/2023-04-linux/35/ => /vagrant[0m
[1m==> ns02: Running provisioner: ansible...[0m
[0m    ns02: Running ansible-playbook...[0m
[0m
PLAY [all] *********************************************************************
[0m[0m
TASK [Gathering Facts] *********************************************************
[0m[0m[0;32mok: [ns02][0m
[0m[0m
TASK [install packages] ********************************************************
[0m[0m[0;33mchanged: [ns02] => (item=bind)[0m
[0m[0m[0;33mchanged: [ns02] => (item=bind-utils)[0m
[0m[0m[0;33mchanged: [ns02] => (item=ntp)[0m
[0m[0m[0;33mchanged: [ns02] => (item=vim)[0m
[0m[0m
TASK [copy transferkey to all servers and the client] **************************
[0m[0m[0;33mchanged: [ns02][0m
[0m[0m
PLAY [ns01] ********************************************************************
[0;36mskipping: no hosts matched[0m
[0m[0m
PLAY [ns02] ********************************************************************
[0m[0m
TASK [Gathering Facts] *********************************************************
[0m[0m[0;32mok: [ns02][0m
[0m[0m
TASK [copy named.conf] *********************************************************
[0m[0m[0;33mchanged: [ns02][0m
[0m[0m
TASK [copy resolv.conf to the servers] *****************************************
[0m[0m[0;33mchanged: [ns02][0m
[0m[0m
TASK [set /etc/named permissions] **********************************************
[0m[0m[0;33mchanged: [ns02][0m
[0m[0m
TASK [set /etc/named permissions] **********************************************
[0m[0m[0;32mok: [ns02][0m
[0m[0m
TASK [ensure named is running and enabled] *************************************
[0m[0m[0;33mchanged: [ns02][0m
[0m[0m[1;35m[WARNING]: Could not match supplied host pattern, ignoring: client[0m
[0m[0m
PLAY [client] ******************************************************************
[0;36mskipping: no hosts matched[0m
[0m[0m
PLAY RECAP *********************************************************************
[0;33mns02[0m                       : [0;32mok=9   [0m [0;33mchanged=6   [0m unreachable=0    failed=0    skipped=0    rescued=0    ignored=0   

[0m[1m==> client: Importing base box 'centos/7'...[0m
[0m[K[0m[0mProgress: 20%[0m[0m[K[0m[0mProgress: 40%[0m[0m[K[0m[0mProgress: 70%[0m[0m[K[0m[0mProgress: 90%[0m[0m[K[0m[1m==> client: Matching MAC address for NAT networking...[0m
[1m==> client: Checking if box 'centos/7' version '2004.01' is up to date...[0m
[1m==> client: Setting the name of the VM: 35_client_1695557398799_85265[0m
[1m==> client: Fixed port collision for 22 => 2222. Now on port 2201.[0m
[1m==> client: Clearing any previously set network interfaces...[0m
[1m==> client: Preparing network interfaces based on configuration...[0m
[0m    client: Adapter 1: nat[0m
[0m    client: Adapter 2: intnet[0m
[1m==> client: Forwarding ports...[0m
[0m    client: 22 (guest) => 2201 (host) (adapter 1)[0m
[1m==> client: Running 'pre-boot' VM customizations...[0m
[1m==> client: Booting VM...[0m
[1m==> client: Waiting for machine to boot. This may take a few minutes...[0m
[0m    client: SSH address: 127.0.0.1:2201[0m
[0m    client: SSH username: vagrant[0m
[0m    client: SSH auth method: private key[0m
[0m    client: 
    client: Vagrant insecure key detected. Vagrant will automatically replace
    client: this with a newly generated keypair for better security.[0m
[0m    client: 
    client: Inserting generated public key within guest...[0m
[0m    client: Removing insecure key from the guest if it's present...[0m
[0m    client: Key inserted! Disconnecting and reconnecting using new SSH key...[0m
[1m==> client: Machine booted and ready![0m
[1m==> client: Checking for guest additions in VM...[0m
[0m    client: No guest additions were detected on the base box for this VM! Guest
    client: additions are required for forwarded ports, shared folders, host only
    client: networking, and more. If SSH fails on this machine, please install
    client: the guest additions and repackage the box to continue.
    client: 
    client: This is not an error message; everything may continue to work properly,
    client: in which case you may ignore this message.[0m
[1m==> client: Setting hostname...[0m
[1m==> client: Configuring and enabling network interfaces...[0m
[1m==> client: Rsyncing folder: /home/zoid/projects/otus/2023-04-linux/35/ => /vagrant[0m
[1m==> client: Running provisioner: ansible...[0m
[0m    client: Running ansible-playbook...[0m
[0m
PLAY [all] *********************************************************************
[0m[0m
TASK [Gathering Facts] *********************************************************
[0m[0m[0;32mok: [client][0m
[0m[0m
TASK [install packages] ********************************************************
[0m[0m[0;33mchanged: [client] => (item=bind)[0m
[0m[0m[0;33mchanged: [client] => (item=bind-utils)[0m
[0m[0m[0;33mchanged: [client] => (item=ntp)[0m
[0m[0m[0;33mchanged: [client] => (item=vim)[0m
[0m[0m
TASK [copy transferkey to all servers and the client] **************************
[0m[0m[0;33mchanged: [client][0m
[0m[0m
PLAY [ns01] ********************************************************************
[0;36mskipping: no hosts matched[0m
[0m[0m
PLAY [ns02] ********************************************************************
[0;36mskipping: no hosts matched[0m
[0m[0m
PLAY [client] ******************************************************************
[0m[0m
TASK [Gathering Facts] *********************************************************
[0m[0m[0;32mok: [client][0m
[0m[0m
TASK [copy resolv.conf to the client] ******************************************
[0m[0m[0;33mchanged: [client][0m
[0m[0m
TASK [copy rndc conf file] *****************************************************
[0m[0m[0;33mchanged: [client][0m
[0m[0m
TASK [copy motd to the client] *************************************************
[0m[0m[0;33mchanged: [client][0m
[0m[0m
PLAY RECAP *********************************************************************
[0;33mclient[0m                     : [0;32mok=7   [0m [0;33mchanged=5   [0m unreachable=0    failed=0    skipped=0    rescued=0    ignored=0   

[0m[1m==> client2: Importing base box 'centos/7'...[0m
[0m[K[0m[0mProgress: 20%[0m[0m[K[0m[0mProgress: 40%[0m[0m[K[0m[0mProgress: 50%[0m[0m[K[0m[0mProgress: 70%[0m[0m[K[0m[0mProgress: 90%[0m[0m[K[0m[1m==> client2: Matching MAC address for NAT networking...[0m
[1m==> client2: Checking if box 'centos/7' version '2004.01' is up to date...[0m
[1m==> client2: Setting the name of the VM: 35_client2_1695557496942_92963[0m
[1m==> client2: Fixed port collision for 22 => 2222. Now on port 2202.[0m
[1m==> client2: Clearing any previously set network interfaces...[0m
[1m==> client2: Preparing network interfaces based on configuration...[0m
[0m    client2: Adapter 1: nat[0m
[0m    client2: Adapter 2: intnet[0m
[1m==> client2: Forwarding ports...[0m
[0m    client2: 22 (guest) => 2202 (host) (adapter 1)[0m
[1m==> client2: Running 'pre-boot' VM customizations...[0m
[1m==> client2: Booting VM...[0m
[1m==> client2: Waiting for machine to boot. This may take a few minutes...[0m
[0m    client2: SSH address: 127.0.0.1:2202[0m
[0m    client2: SSH username: vagrant[0m
[0m    client2: SSH auth method: private key[0m
[0m    client2: 
    client2: Vagrant insecure key detected. Vagrant will automatically replace
    client2: this with a newly generated keypair for better security.[0m
[0m    client2: 
    client2: Inserting generated public key within guest...[0m
[0m    client2: Removing insecure key from the guest if it's present...[0m
[0m    client2: Key inserted! Disconnecting and reconnecting using new SSH key...[0m
[1m==> client2: Machine booted and ready![0m
[1m==> client2: Checking for guest additions in VM...[0m
[0m    client2: No guest additions were detected on the base box for this VM! Guest
    client2: additions are required for forwarded ports, shared folders, host only
    client2: networking, and more. If SSH fails on this machine, please install
    client2: the guest additions and repackage the box to continue.
    client2: 
    client2: This is not an error message; everything may continue to work properly,
    client2: in which case you may ignore this message.[0m
[1m==> client2: Setting hostname...[0m
[1m==> client2: Configuring and enabling network interfaces...[0m
[1m==> client2: Rsyncing folder: /home/zoid/projects/otus/2023-04-linux/35/ => /vagrant[0m
[1m==> client2: Running provisioner: ansible...[0m
[0m    client2: Running ansible-playbook...[0m
[0m
PLAY [all] *********************************************************************
[0m[0m
TASK [Gathering Facts] *********************************************************
[0m[0m[0;32mok: [client2][0m
[0m[0m
TASK [install packages] ********************************************************
[0m[0m[0;33mchanged: [client2] => (item=bind)[0m
[0m[0m[0;33mchanged: [client2] => (item=bind-utils)[0m
[0m[0m[0;33mchanged: [client2] => (item=ntp)[0m
[0m[0m[0;33mchanged: [client2] => (item=vim)[0m
[0m[0m
TASK [copy transferkey to all servers and the client] **************************
[0m[0m[0;33mchanged: [client2][0m
[0m[0m
PLAY [ns01] ********************************************************************
[0;36mskipping: no hosts matched[0m
[0m[0m
PLAY [ns02] ********************************************************************
[0;36mskipping: no hosts matched[0m
[0m[0m
PLAY [client] ******************************************************************
[0;36mskipping: no hosts matched[0m

PLAY RECAP *********************************************************************
[0;33mclient2[0m                    : [0;32mok=3   [0m [0;33mchanged=2   [0m unreachable=0    failed=0    skipped=0    rescued=0    ignored=0   

[0m[?2004h]0;zoid@dll: ~/projects/otus/2023-04-linux/35[01;32mzoid@dll[00m:[01;34m~/projects/otus/2023-04-linux/35[00m$ 
[?2004l[?2004h]0;zoid@dll: ~/projects/otus/2023-04-linux/35[01;32mzoid@dll[00m:[01;34m~/projects/otus/2023-04-linux/35[00m$ 
[?2004l[?2004h]0;zoid@dll: ~/projects/otus/2023-04-linux/35[01;32mzoid@dll[00m:[01;34m~/projects/otus/2023-04-linux/35[00m$ 
[?2004l[?2004h]0;zoid@dll: ~/projects/otus/2023-04-linux/35[01;32mzoid@dll[00m:[01;34m~/projects/otus/2023-04-linux/35[00m$ vagrant ssh ns01
[?2004lLast login: Sun Sep 24 12:08:03 2023 from 10.0.2.2
]0;vagrant@ns01:~[?1034h[vagrant@ns01 ~]$ dig @192.168.50.10 web1.dns.lab

; <<>> DiG 9.11.4-P2-RedHat-9.11.4-26.P2.el7_9.14 <<>> @192.168.50.10 web1.dns.lab
; (1 server found)
;; global options: +cmd
;; Got answer:
;; ->>HEADER<<- opcode: QUERY, status: NOERROR, id: 27550
;; flags: qr aa rd ra; QUERY: 1, ANSWER: 1, AUTHORITY: 2, ADDITIONAL: 3

;; OPT PSEUDOSECTION:
; EDNS: version: 0, flags:; udp: 4096
;; QUESTION SECTION:
;web1.dns.lab.			IN	A

;; ANSWER SECTION:
web1.dns.lab.		3600	IN	A	192.168.50.15

;; AUTHORITY SECTION:
dns.lab.		3600	IN	NS	ns02.dns.lab.
dns.lab.		3600	IN	NS	ns01.dns.lab.

;; ADDITIONAL SECTION:
ns01.dns.lab.		3600	IN	A	192.168.50.10
ns02.dns.lab.		3600	IN	A	192.168.50.11

;; Query time: 0 msec
;; SERVER: 192.168.50.10#53(192.168.50.10)
;; WHEN: Sun Sep 24 12:13:45 UTC 2023
;; MSG SIZE  rcvd: 127

]0;vagrant@ns01:~[vagrant@ns01 ~]$ dig @192.168.50.11 web2.dns.lab

; <<>> DiG 9.11.4-P2-RedHat-9.11.4-26.P2.el7_9.14 <<>> @192.168.50.11 web2.dns.lab
; (1 server found)
;; global options: +cmd
;; Got answer:
;; ->>HEADER<<- opcode: QUERY, status: NOERROR, id: 14840
;; flags: qr aa rd ra; QUERY: 1, ANSWER: 1, AUTHORITY: 2, ADDITIONAL: 3

;; OPT PSEUDOSECTION:
; EDNS: version: 0, flags:; udp: 4096
;; QUESTION SECTION:
;web2.dns.lab.			IN	A

;; ANSWER SECTION:
web2.dns.lab.		3600	IN	A	192.168.50.16

;; AUTHORITY SECTION:
dns.lab.		3600	IN	NS	ns01.dns.lab.
dns.lab.		3600	IN	NS	ns02.dns.lab.

;; ADDITIONAL SECTION:
ns01.dns.lab.		3600	IN	A	192.168.50.10
ns02.dns.lab.		3600	IN	A	192.168.50.11

;; Query time: 0 msec
;; SERVER: 192.168.50.11#53(192.168.50.11)
;; WHEN: Sun Sep 24 12:13:53 UTC 2023
;; MSG SIZE  rcvd: 127

]0;vagrant@ns01:~[vagrant@ns01 ~]$ 
]0;vagrant@ns01:~[vagrant@ns01 ~]$ 
]0;vagrant@ns01:~[vagrant@ns01 ~]$ 
]0;vagrant@ns01:~[vagrant@ns01 ~]$ dig @192.168.50.10 www.newdns.lab

; <<>> DiG 9.11.4-P2-RedHat-9.11.4-26.P2.el7_9.14 <<>> @192.168.50.10 www.newdns.lab
; (1 server found)
;; global options: +cmd
;; Got answer:
;; ->>HEADER<<- opcode: QUERY, status: NOERROR, id: 30462
;; flags: qr aa rd ra; QUERY: 1, ANSWER: 2, AUTHORITY: 2, ADDITIONAL: 3

;; OPT PSEUDOSECTION:
; EDNS: version: 0, flags:; udp: 4096
;; QUESTION SECTION:
;www.newdns.lab.			IN	A

;; ANSWER SECTION:
www.newdns.lab.		3600	IN	A	192.168.50.16
www.newdns.lab.		3600	IN	A	192.168.50.15

;; AUTHORITY SECTION:
newdns.lab.		3600	IN	NS	ns01.dns.lab.
newdns.lab.		3600	IN	NS	ns02.dns.lab.

;; ADDITIONAL SECTION:
ns01.dns.lab.		3600	IN	A	192.168.50.10
ns02.dns.lab.		3600	IN	A	192.168.50.11

;; Query time: 0 msec
;; SERVER: 192.168.50.10#53(192.168.50.10)
;; WHEN: Sun Sep 24 12:14:01 UTC 2023
;; MSG SIZE  rcvd: 149

]0;vagrant@ns01:~[vagrant@ns01 ~]$ 
]0;vagrant@ns01:~[vagrant@ns01 ~]$ 
]0;vagrant@ns01:~[vagrant@ns01 ~]$ 
]0;vagrant@ns01:~[vagrant@ns01 ~]$ 
]0;vagrant@ns01:~[vagrant@ns01 ~]$ dig @192.168.50.11 www.newdns.lab

; <<>> DiG 9.11.4-P2-RedHat-9.11.4-26.P2.el7_9.14 <<>> @192.168.50.11 www.newdns.lab
; (1 server found)
;; global options: +cmd
;; Got answer:
;; ->>HEADER<<- opcode: QUERY, status: NOERROR, id: 37676
;; flags: qr aa rd ra; QUERY: 1, ANSWER: 2, AUTHORITY: 2, ADDITIONAL: 3

;; OPT PSEUDOSECTION:
; EDNS: version: 0, flags:; udp: 4096
;; QUESTION SECTION:
;www.newdns.lab.			IN	A

;; ANSWER SECTION:
www.newdns.lab.		3600	IN	A	192.168.50.16
www.newdns.lab.		3600	IN	A	192.168.50.15

;; AUTHORITY SECTION:
newdns.lab.		3600	IN	NS	ns02.dns.lab.
newdns.lab.		3600	IN	NS	ns01.dns.lab.

;; ADDITIONAL SECTION:
ns01.dns.lab.		3600	IN	A	192.168.50.10
ns02.dns.lab.		3600	IN	A	192.168.50.11

;; Query time: 0 msec
;; SERVER: 192.168.50.11#53(192.168.50.11)
;; WHEN: Sun Sep 24 12:14:11 UTC 2023
;; MSG SIZE  rcvd: 149

]0;vagrant@ns01:~[vagrant@ns01 ~]$ 
]0;vagrant@ns01:~[vagrant@ns01 ~]$ 
]0;vagrant@ns01:~[vagrant@ns01 ~]$ 
]0;vagrant@ns01:~[vagrant@ns01 ~]$ logout
[?2004h]0;zoid@dll: ~/projects/otus/2023-04-linux/35[01;32mzoid@dll[00m:[01;34m~/projects/otus/2023-04-linux/35[00m$ vagrant destroy 0f[K[Kf[K-f
[?2004l[1m==> client2: Forcing shutdown of VM...[0m
[1m==> client2: Destroying VM and associated drives...[0m
[1m==> client: Forcing shutdown of VM...[0m
[1m==> client: Destroying VM and associated drives...[0m
[1m==> ns02: Forcing shutdown of VM...[0m
[1m==> ns02: Destroying VM and associated drives...[0m
[1m==> ns01: Forcing shutdown of VM...[0m
[1m==> ns01: Destroying VM and associated drives...[0m
[?2004h]0;zoid@dll: ~/projects/otus/2023-04-linux/35[01;32mzoid@dll[00m:[01;34m~/projects/otus/2023-04-linux/35[00m$ 
[?2004l[?2004h]0;zoid@dll: ~/projects/otus/2023-04-linux/35[01;32mzoid@dll[00m:[01;34m~/projects/otus/2023-04-linux/35[00m$ 
[?2004l[?2004h]0;zoid@dll: ~/projects/otus/2023-04-linux/35[01;32mzoid@dll[00m:[01;34m~/projects/otus/2023-04-linux/35[00m$ 
[?2004l[?2004h]0;zoid@dll: ~/projects/otus/2023-04-linux/35[01;32mzoid@dll[00m:[01;34m~/projects/otus/2023-04-linux/35[00m$ vim Vagrantfile 
[?2004l[?1049h[22;0;0t[>4;2m[?1h=[?2004h[?1004h[1;42r[?12h[?12l[22;2t[22;1t[27m[23m[29m[m[38;5;254m[48;5;233m[H[2J[?25l[42;1H"Vagrantfile" 38L, 1051B[?2004l[>4;m[>4;m[>4;2m[?2004h[>4;2m[2;1H▽[6n[2;1H  [3;1HPzz\[0%m[6n[3;1H           [1;1H[>c]10;?]11;?[?12$p[?2004l[>4;m[>4;m[>4;2m[?2004h[>4;2m[1;1H[38;5;248m1   [m[38;5;254m[48;5;233m[38;5;137m[48;5;234m# -*- mode: ruby -*-[m[38;5;254m[48;5;233m[48;5;234m                                                                                                    [m[38;5;254m[48;5;233m[2;1H[38;5;242m  1 [m[38;5;254m[48;5;233m[38;5;137m# vi: set ft=ruby :[m[38;5;254m[48;5;233m                                                  [48;5;234m [m[38;5;254m[48;5;233m[2;75H[K[3;1H[38;5;242m  2 [m[38;5;254m[48;5;233m                                                                     [48;5;234m [m[38;5;254m[48;5;233m[3;75H[K[4;1H[38;5;242m  3 [m[38;5;254m[48;5;233m[38;5;167mVagrant[m[38;5;254m[48;5;233m.configure([38;5;107m2[m[38;5;254m[48;5;233m) [38;5;130mdo[m[38;5;254m[48;5;233m |config|[37C[48;5;234m [m[38;5;254m[48;5;233m
[38;5;242m  4 [m[38;5;254m[48;5;233m  config.vm.box = [38;5;107m"centos/7"[m[38;5;254m[48;5;233m[41C[48;5;234m [m[38;5;254m[48;5;233m
[38;5;242m  5 [m[38;5;254m[48;5;233m[69C[48;5;234m [m[38;5;254m[48;5;233m
[38;5;242m  6 [m[38;5;254m[48;5;233m  config.vm.provision [38;5;107m"ansible"[m[38;5;254m[48;5;233m [38;5;130mdo[m[38;5;254m[48;5;233m |ansible|[25C[48;5;234m [m[38;5;254m[48;5;233m
[38;5;242m  7 [m[38;5;254m[48;5;233m  [38;5;239m¦[m[38;5;254m[48;5;233m [38;5;137m# ansible.verbose = "vvv"[m[38;5;254m[48;5;233m[40C[48;5;234m [m[38;5;254m[48;5;233m
[38;5;242m  8 [m[38;5;254m[48;5;233m  [38;5;239m¦[m[38;5;254m[48;5;233m ansible.playbook = [38;5;107m"provisioning/playbook.yml"[m[38;5;254m[48;5;233m[19C[48;5;234m [m[38;5;254m[48;5;233m
[38;5;242m  9 [m[38;5;254m[48;5;233m  [38;5;239m¦[m[38;5;254m[48;5;233m [38;5;137m# ansible.playbook = "provisioning2/playbook.yml"[m[38;5;254m[48;5;233m[16C[48;5;234m [m[38;5;254m[48;5;233m
[38;5;242m 10 [m[38;5;254m[48;5;233m  [38;5;239m¦[m[38;5;254m[48;5;233m ansible.become = [38;5;107m"true"[m[38;5;254m[48;5;233m[42C[48;5;234m [m[38;5;254m[48;5;233m
[38;5;242m 11 [m[38;5;254m[48;5;233m  [38;5;130mend[m[38;5;254m[48;5;233m[64C[48;5;234m [m[38;5;254m[48;5;233m
[38;5;242m 12 [m[38;5;254m[48;5;233m[69C[48;5;234m [m[38;5;254m[48;5;233m
[38;5;242m 13 [m[38;5;254m[48;5;233m[69C[48;5;234m [m[38;5;254m[48;5;233m
[38;5;242m 14 [m[38;5;254m[48;5;233m  config.vm.provider [38;5;107m"virtualbox"[m[38;5;254m[48;5;233m [38;5;130mdo[m[38;5;254m[48;5;233m |v|[29C[48;5;234m [m[38;5;254m[48;5;233m
[38;5;242m 15 [m[38;5;254m[48;5;233m  [38;5;239m¦[m[38;5;254m[48;5;233m v.memory = [38;5;107m256[m[38;5;254m[48;5;233m[51C[48;5;234m [m[38;5;254m[48;5;233m
[38;5;242m 16 [m[38;5;254m[48;5;233m  [38;5;130mend[m[38;5;254m[48;5;233m[64C[48;5;234m [m[38;5;254m[48;5;233m
[38;5;242m 17 [m[38;5;254m[48;5;233m[69C[48;5;234m [m[38;5;254m[48;5;233m
[38;5;242m 18 [m[38;5;254m[48;5;233m  config.vm.define [38;5;107m"ns01"[m[38;5;254m[48;5;233m [38;5;130mdo[m[38;5;254m[48;5;233m |ns01|[34C[48;5;234m [m[38;5;254m[48;5;233m
[38;5;242m 19 [m[38;5;254m[48;5;233m  [38;5;239m¦[m[38;5;254m[48;5;233m ns01.vm.network [38;5;107m"private_network"[m[38;5;254m[48;5;233m, [38;5;73mip[m[38;5;254m[48;5;233m: [38;5;107m"192.168.50.10"[m[38;5;254m[48;5;233m, [38;5;73mvirtualbo[m[38;5;254m[48;5;233m[38;5;73m[48;5;234mx[m[38;5;254m[48;5;233m[38;5;73m__intnet[m[38;5;254m[48;5;233m: [38;5;107m"dns"[m[38;5;254m[48;5;233m
[38;5;242m 20 [m[38;5;254m[48;5;233m  [38;5;239m¦[m[38;5;254m[48;5;233m ns01.vm.hostname = [38;5;107m"ns01"[m[38;5;254m[48;5;233m[40C[48;5;234m [m[38;5;254m[48;5;233m
[38;5;242m 21 [m[38;5;254m[48;5;233m  [38;5;130mend[m[38;5;254m[48;5;233m[64C[48;5;234m [m[38;5;254m[48;5;233m
[38;5;242m 22 [m[38;5;254m[48;5;233m[69C[48;5;234m [m[38;5;254m[48;5;233m
[38;5;242m 23 [m[38;5;254m[48;5;233m  config.vm.define [38;5;107m"ns02"[m[38;5;254m[48;5;233m [38;5;130mdo[m[38;5;254m[48;5;233m |ns02|[34C[48;5;234m [m[38;5;254m[48;5;233m
[38;5;242m 24 [m[38;5;254m[48;5;233m  [38;5;239m¦[m[38;5;254m[48;5;233m ns02.vm.network [38;5;107m"private_network"[m[38;5;254m[48;5;233m, [38;5;73mip[m[38;5;254m[48;5;233m: [38;5;107m"192.168.50.11"[m[38;5;254m[48;5;233m, [38;5;73mvirtualbo[m[38;5;254m[48;5;233m[38;5;73m[48;5;234mx[m[38;5;254m[48;5;233m[38;5;73m__intnet[m[38;5;254m[48;5;233m: [38;5;107m"dns"[m[38;5;254m[48;5;233m
[38;5;242m 25 [m[38;5;254m[48;5;233m  [38;5;239m¦[m[38;5;254m[48;5;233m ns02.vm.hostname = [38;5;107m"ns02"[m[38;5;254m[48;5;233m[40C[48;5;234m [m[38;5;254m[48;5;233m
[38;5;242m 26 [m[38;5;254m[48;5;233m  [38;5;130mend[m[38;5;254m[48;5;233m[64C[48;5;234m [m[38;5;254m[48;5;233m
[38;5;242m 27 [m[38;5;254m[48;5;233m[69C[48;5;234m [m[38;5;254m[48;5;233m
[38;5;242m 28 [m[38;5;254m[48;5;233m  config.vm.define [38;5;107m"client"[m[38;5;254m[48;5;233m [38;5;130mdo[m[38;5;254m[48;5;233m |client|[30C[48;5;234m [m[38;5;254m[48;5;233m
[38;5;242m 29 [m[38;5;254m[48;5;233m  [38;5;239m¦[m[38;5;254m[48;5;233m client.vm.network [38;5;107m"private_network"[m[38;5;254m[48;5;233m, [38;5;73mip[m[38;5;254m[48;5;233m: [38;5;107m"192.168.50.15"[m[38;5;254m[48;5;233m, [38;5;73mvirtual[m[38;5;254m[48;5;233m[38;5;73m[48;5;234mb[m[38;5;254m[48;5;233m[38;5;73mox__intnet[m[38;5;254m[48;5;233m: [38;5;107m"dns"[m[38;5;254m[48;5;233m
[38;5;242m 30 [m[38;5;254m[48;5;233m  [38;5;239m¦[m[38;5;254m[48;5;233m client.vm.hostname = [38;5;107m"client"[m[38;5;254m[48;5;233m[36C[48;5;234m [m[38;5;254m[48;5;233m
[38;5;242m 31 [m[38;5;254m[48;5;233m  [38;5;130mend[m[38;5;254m[48;5;233m[64C[48;5;234m [m[38;5;254m[48;5;233m
[38;5;242m 32 [m[38;5;254m[48;5;233m[69C[48;5;234m [m[38;5;254m[48;5;233m
[38;5;242m 33 [m[38;5;254m[48;5;233m  config.vm.define [38;5;107m"client2"[m[38;5;254m[48;5;233m [38;5;130mdo[m[38;5;254m[48;5;233m |client2|[28C[48;5;234m [m[38;5;254m[48;5;233m
[38;5;242m 34 [m[38;5;254m[48;5;233m  [38;5;239m¦[m[38;5;254m[48;5;233m client2.vm.network [38;5;107m"private_network"[m[38;5;254m[48;5;233m, [38;5;73mip[m[38;5;254m[48;5;233m: [38;5;107m"192.168.50.16"[m[38;5;254m[48;5;233m, [38;5;73mvirtua[m[38;5;254m[48;5;233m[38;5;73m[48;5;234ml[m[38;5;254m[48;5;233m[38;5;73mbox__intnet[m[38;5;254m[48;5;233m: [38;5;107m"dns"[m[38;5;254m[48;5;233m
[38;5;242m 35 [m[38;5;254m[48;5;233m  [38;5;239m¦[m[38;5;254m[48;5;233m client2.vm.hostname = [38;5;107m"client2"[m[38;5;254m[48;5;233m[34C[48;5;234m [m[38;5;254m[48;5;233m
[38;5;242m 36 [m[38;5;254m[48;5;233m  [38;5;130mend[m[38;5;254m[48;5;233m[64C[48;5;234m [m[38;5;254m[48;5;233m
[38;5;242m 37 [m[38;5;254m[48;5;233m[38;5;130mend[m[38;5;254m[48;5;233m[66C[48;5;234m [m[38;5;254m[48;5;233m
[38;5;243m~                                                                                                                           [40;1H~                                                                                                                           [m[38;5;254m[48;5;233m[41;1H[38;5;254m[48;5;241m                                                                                                                            [1;5H[?25h[?4m[?25l[m[38;5;254m[48;5;233m[38;5;242m  1 [m[38;5;254m[48;5;233m[38;5;137m# -*- mode: ruby -*-[m[38;5;254m[48;5;233m                                                 [1;75H[K[2;1H[38;5;248m2   [m[38;5;254m[48;5;233m[38;5;137m[48;5;234m# vi: set ft=ruby :[m[38;5;254m[48;5;233m[48;5;234m                                                                                                     [m[38;5;254m[48;5;233m[3;3H[38;5;242m1
  2
  3
  4
  5
  6
  7
  8
  9
 10
 11
 12
 13
 14
 15
 16
 17
 18
 19
 20
 21
 22
 23
 24
 25
 26
 27
 28
 29
 30
 31
 32
 33
 34
 35
 36[2;5H[?25h[?25l[1;3H2
  1 [m[38;5;254m[48;5;233m[38;5;137m# vi: set ft=ruby :[m[38;5;254m[48;5;233m                                                  [2;75H[K[3;1H[38;5;248m3   [m[38;5;254m[48;5;233m[48;5;234m                                                                                                                        [m[38;5;254m[48;5;233m[4;3H[38;5;242m1
  2
  3
  4
  5
  6
  7
  8
  9
 10
 11
 12
 13
 14
 15
 16
 17
 18
 19
 20
 21
 22
 23
 24
 25
 26
 27
 28
 29
 30
 31
 32
 33
 34
 35[3;5H[?25h[?25l[1;3H3
  2
  1 [m[38;5;254m[48;5;233m                                                                     [3;75H[K[4;1H[38;5;248m4   [m[38;5;254m[48;5;233m[38;5;167m[48;5;234mVagrant[m[38;5;254m[48;5;233m[48;5;234m.configure([m[38;5;254m[48;5;233m[38;5;107m[48;5;234m2[m[38;5;254m[48;5;233m[48;5;234m) [m[38;5;254m[48;5;233m[38;5;130m[48;5;234mdo[m[38;5;254m[48;5;233m[48;5;234m |config|                                                                                        [m[38;5;254m[48;5;233m[5;3H[38;5;242m1
  2
  3
  4
  5
  6
  7
  8
  9
 10
 11
 12
 13
 14
 15
 16
 17
 18
 19
 20
 21
 22
 23
 24
 25
 26
 27
 28
 29
 30
 31
 32
 33
 34[4;5H[?25h[?25l[1;3H4
  3
  2
  1 [m[38;5;254m[48;5;233m[38;5;167mVagrant[m[38;5;254m[48;5;233m.configure([38;5;107m2[m[38;5;254m[48;5;233m) [38;5;130mdo[m[38;5;254m[48;5;233m |config|                                     [4;75H[K[5;1H[38;5;248m5   [m[38;5;254m[48;5;233m[48;5;234m  config.vm.box = [m[38;5;254m[48;5;233m[38;5;107m[48;5;234m"centos/7"[m[38;5;254m[48;5;233m[48;5;234m                                                                                            [m[38;5;254m[48;5;233m[6;3H[38;5;242m1
  2
  3
  4
  5
  6
  7
  8
  9
 10
 11
 12
 13
 14
 15
 16
 17
 18
 19
 20
 21
 22
 23
 24
 25
 26
 27
 28
 29
 30
 31
 32
 33[5;5H[?25h[?25l[1;3H5
  4
  3
  2
  1 [m[38;5;254m[48;5;233m  config.vm.box = [38;5;107m"centos/7"[m[38;5;254m[48;5;233m                                         [5;75H[K[6;1H[38;5;248m6   [m[38;5;254m[48;5;233m[48;5;234m                                                                                                                        [m[38;5;254m[48;5;233m[7;3H[38;5;242m1
  2
  3
  4
  5
  6
  7
  8
  9
 10
 11
 12
 13
 14
 15
 16
 17
 18
 19
 20
 21
 22
 23
 24
 25
 26
 27
 28
 29
 30
 31
 32[6;5H[?25h[?25l[1;3H6
  5
  4
  3
  2
  1 [m[38;5;254m[48;5;233m                                                                     [6;75H[K[7;1H[38;5;248m7   [m[38;5;254m[48;5;233m[48;5;234m  config.vm.provision [m[38;5;254m[48;5;233m[38;5;107m[48;5;234m"ansible"[m[38;5;254m[48;5;233m[48;5;234m [m[38;5;254m[48;5;233m[38;5;130m[48;5;234mdo[m[38;5;254m[48;5;233m[48;5;234m |ansible|                                                                            [m[38;5;254m[48;5;233m[8;3H[38;5;242m1
  2
  3
  4
  5
  6
  7
  8
  9
 10
 11
 12
 13
 14
 15
 16
 17
 18
 19
 20
 21
 22
 23
 24
 25
 26
 27
 28
 29
 30
 31[7;5H[?25h[?25l[1;3H7
  6
  5
  4
  3
  2
  1 [m[38;5;254m[48;5;233m  config.vm.provision [38;5;107m"ansible"[m[38;5;254m[48;5;233m [38;5;130mdo[m[38;5;254m[48;5;233m |ansible|                         [7;75H[K[8;1H[38;5;248m8   [m[38;5;254m[48;5;233m[48;5;234m  [1C [m[38;5;254m[48;5;233m[38;5;137m[48;5;234m# ansible.verbose = "vvv"[m[38;5;254m[48;5;233m[48;5;234m                                                                                           [m[38;5;254m[48;5;233m[9;3H[38;5;242m1
  2
  3
  4
  5
  6
  7
  8
  9
 10
 11
 12
 13
 14
 15
 16
 17
 18
 19
 20
 21
 22
 23
 24
 25
 26
 27
 28
 29
 30[8;5H[?25h[?25l[1;3H8
  7
  6
  5
  4
  3
  2
  1 [m[38;5;254m[48;5;233m  [1C [38;5;137m# ansible.verbose = "vvv"[m[38;5;254m[48;5;233m                                        [8;75H[K[9;1H[38;5;248m9   [m[38;5;254m[48;5;233m[48;5;234m  [1C ansible.playbook = [m[38;5;254m[48;5;233m[38;5;107m[48;5;234m"provisioning/playbook.yml"[m[38;5;254m[48;5;233m[48;5;234m                                                                      [m[38;5;254m[48;5;233m[10;3H[38;5;242m1
  2
  3
  4
  5
  6
  7
  8
  9
 10
 11
 12
 13
 14
 15
 16
 17
 18
 19
 20
 21
 22
 23
 24
 25
 26
 27
 28
 29[9;5H[?25h[?25l[1;3H9
  8
  7
  6
  5
  4
  3
  2
  1 [m[38;5;254m[48;5;233m  [1C ansible.playbook = [38;5;107m"provisioning/playbook.yml"[m[38;5;254m[48;5;233m                   [9;75H[K[10;1H[38;5;248m10  [m[38;5;254m[48;5;233m[48;5;234m  [1C [m[38;5;254m[48;5;233m[38;5;137m[48;5;234m# ansible.playbook = "provisioning2/playbook.yml"[m[38;5;254m[48;5;233m[48;5;234m                                                                   [m[38;5;254m[48;5;233m[11;3H[38;5;242m1
  2
  3
  4
  5
  6
  7
  8
  9
 10
 11
 12
 13
 14
 15
 16
 17
 18
 19
 20
 21
 22
 23
 24
 25
 26
 27
 28[10;5H[?25h[?25l[1;3H8
  7
  6
  5
  4
  3
  2
  1[m[38;5;254m[48;5;233m
[38;5;248m9   [m[38;5;254m[48;5;233m[48;5;234m  [1C ansible.playbook = [m[38;5;254m[48;5;233m[38;5;107m[48;5;234m"provisioning/playbook.yml"[m[38;5;254m[48;5;233m[48;5;234m                                                                      [m[38;5;254m[48;5;233m[10;1H[38;5;242m  1 [m[38;5;254m[48;5;233m  [1C [38;5;137m# ansible.playbook = "provisioning2/playbook.yml"[m[38;5;254m[48;5;233m                [10;75H[K[11;3H[38;5;242m2
  3
  4
  5
  6
  7
  8
  9
 10
 11
 12
 13
 14
 15
 16
 17
 18
 19
 20
 21
 22
 23
 24
 25
 26
 27
 28
 29[9;5H[?25h[?25l[?25h[?25l[m[38;5;254m[48;5;233m[4C[38;5;137m[48;5;234m# ansible.playbook = "provisioning/playbook.yml"[9;5H[?25h[?25l[m[38;5;254m[48;5;233m[1;3H[38;5;242m9
  8
  7
  6
  5
  4
  3
  2
  1 [m[38;5;254m[48;5;233m  [1C [38;5;137m# ansible.playbook = "provisioning/playbook.yml"[m[38;5;254m[48;5;233m                 [9;75H[K[10;1H[38;5;248m10  [m[38;5;254m[48;5;233m[48;5;234m  [1C [m[38;5;254m[48;5;233m[38;5;137m[48;5;234m# ansible.playbook = "provisioning2/playbook.yml"[m[38;5;254m[48;5;233m[48;5;234m                                                                   [m[38;5;254m[48;5;233m[11;3H[38;5;242m1
  2
  3
  4
  5
  6
  7
  8
  9
 10
 11
 12
 13
 14
 15
 16
 17
 18
 19
 20
 21
 22
 23
 24
 25
 26
 27
 28[10;5H[?25h[?25l[?25h[?25l[m[38;5;254m[48;5;233m[4C[48;5;234mansible.playbook = [m[38;5;254m[48;5;233m[38;5;107m[48;5;234m"provisioning2/playbook.yml"[m[38;5;254m[48;5;233m[48;5;234m  [10;5H[?25h[?25l[?25h[?25l[m[38;5;254m[48;5;233m[42;1H[K[42;1H:[?25hW[?25l"Vagrantfile" 38L, 1051B з[42;27Hа[42;28Hп[42;29Hи[42;30H[42;31Hа[42;32Hн[42;33Hо[?2004l[>4;m[>4;m[>4;2m[?2004h[>4;2m[10;5H[?25h[?4m[?25l[42;1H[K[42;1H:[?25hq[?25l[?2004l[>4;m[23;2t[23;1t[42;1H[K[42;1H[?1004l[?2004l[?1l>[?25h[>4;m[?1049l[23;0;0t[?2004h]0;zoid@dll: ~/projects/otus/2023-04-linux/35[01;32mzoid@dll[00m:[01;34m~/projects/otus/2023-04-linux/35[00m$ 
[?2004l[?2004h]0;zoid@dll: ~/projects/otus/2023-04-linux/35[01;32mzoid@dll[00m:[01;34m~/projects/otus/2023-04-linux/35[00m$ 
[?2004l[?2004h]0;zoid@dll: ~/projects/otus/2023-04-linux/35[01;32mzoid@dll[00m:[01;34m~/projects/otus/2023-04-linux/35[00m$ 
[?2004l[?2004h]0;zoid@dll: ~/projects/otus/2023-04-linux/35[01;32mzoid@dll[00m:[01;34m~/projects/otus/2023-04-linux/35[00m$ vagrant up
[?2004l[0mBringing machine 'ns01' up with 'virtualbox' provider...[0m
[0mBringing machine 'ns02' up with 'virtualbox' provider...[0m
[0mBringing machine 'client' up with 'virtualbox' provider...[0m
[0mBringing machine 'client2' up with 'virtualbox' provider...[0m
[1m==> ns01: Importing base box 'centos/7'...[0m
[0m[K[0m[0mProgress: 20%[0m[0m[K[0m[0mProgress: 40%[0m[0m[K[0m[0mProgress: 70%[0m[0m[K[0m[0mProgress: 90%[0m[0m[K[0m[1m==> ns01: Matching MAC address for NAT networking...[0m
[1m==> ns01: Checking if box 'centos/7' version '2004.01' is up to date...[0m
[1m==> ns01: Setting the name of the VM: 35_ns01_1695557718622_70899[0m
[1m==> ns01: Clearing any previously set network interfaces...[0m
[1m==> ns01: Preparing network interfaces based on configuration...[0m
[0m    ns01: Adapter 1: nat[0m
[0m    ns01: Adapter 2: intnet[0m
[1m==> ns01: Forwarding ports...[0m
[0m    ns01: 22 (guest) => 2222 (host) (adapter 1)[0m
[1m==> ns01: Running 'pre-boot' VM customizations...[0m
[1m==> ns01: Booting VM...[0m
[1m==> ns01: Waiting for machine to boot. This may take a few minutes...[0m
[0m    ns01: SSH address: 127.0.0.1:2222[0m
[0m    ns01: SSH username: vagrant[0m
[0m    ns01: SSH auth method: private key[0m
[0m    ns01: 
    ns01: Vagrant insecure key detected. Vagrant will automatically replace
    ns01: this with a newly generated keypair for better security.[0m
[0m    ns01: 
    ns01: Inserting generated public key within guest...[0m
[0m    ns01: Removing insecure key from the guest if it's present...[0m
[0m    ns01: Key inserted! Disconnecting and reconnecting using new SSH key...[0m
[1m==> ns01: Machine booted and ready![0m
[1m==> ns01: Checking for guest additions in VM...[0m
[0m    ns01: No guest additions were detected on the base box for this VM! Guest
    ns01: additions are required for forwarded ports, shared folders, host only
    ns01: networking, and more. If SSH fails on this machine, please install
    ns01: the guest additions and repackage the box to continue.
    ns01: 
    ns01: This is not an error message; everything may continue to work properly,
    ns01: in which case you may ignore this message.[0m
[1m==> ns01: Setting hostname...[0m
[1m==> ns01: Configuring and enabling network interfaces...[0m
[1m==> ns01: Rsyncing folder: /home/zoid/projects/otus/2023-04-linux/35/ => /vagrant[0m
[1m==> ns01: Running provisioner: ansible...[0m
[0m    ns01: Running ansible-playbook...[0m
[0m
PLAY [all] *********************************************************************
[0m[0m
TASK [Gathering Facts] *********************************************************
[0m[0m[0;32mok: [ns01][0m
[0m[0m
TASK [install packages] ********************************************************
[0m[0m[0;33mchanged: [ns01] => (item=bind)[0m
[0m[0m[0;33mchanged: [ns01] => (item=bind-utils)[0m
[0m[0m[0;33mchanged: [ns01] => (item=ntp)[0m
[0m[0m[0;33mchanged: [ns01] => (item=vim)[0m
[0m[0m
TASK [copy transferkey to all servers and the client] **************************
[0m[0m[0;33mchanged: [ns01][0m
[0m[0m
PLAY [ns01] ********************************************************************
[0m[0m
TASK [Gathering Facts] *********************************************************
[0m[0m[0;32mok: [ns01][0m
[0m[0m
TASK [copy named.conf] *********************************************************
[0m[0m[0;33mchanged: [ns01][0m
[0m[0m
TASK [copy zones] **************************************************************
[0m[0m[0;33mchanged: [ns01] => (item=/home/zoid/projects/otus/2023-04-linux/35/provisioning2/named.dns.lab)[0m
[0m[0m[0;33mchanged: [ns01] => (item=/home/zoid/projects/otus/2023-04-linux/35/provisioning2/named.ddns.lab)[0m
[0m[0m[0;33mchanged: [ns01] => (item=/home/zoid/projects/otus/2023-04-linux/35/provisioning2/named.dns.lab.client)[0m
[0m[0m[0;33mchanged: [ns01] => (item=/home/zoid/projects/otus/2023-04-linux/35/provisioning2/named.dns.lab.rev)[0m
[0m[0m[0;33mchanged: [ns01] => (item=/home/zoid/projects/otus/2023-04-linux/35/provisioning2/named.newdns.lab)[0m
[0m[0m
TASK [copy resolv.conf to the servers] *****************************************
[0m[0m[0;33mchanged: [ns01][0m
[0m[0m
TASK [set /etc/named permissions] **********************************************
[0m[0m[0;33mchanged: [ns01][0m
[0m[0m
TASK [ensure named is running and enabled] *************************************
[0m[0m[0;33mchanged: [ns01][0m
[0m[0m[1;35m[WARNING]: Could not match supplied host pattern, ignoring: ns02[0m
[0m[0m
PLAY [ns02] ********************************************************************
[0;36mskipping: no hosts matched[0m
[0m[0m[1;35m[WARNING]: Could not match supplied host pattern, ignoring: client[0m
[1;35m[WARNING]: Could not match supplied host pattern, ignoring: client2[0m
[0m[0m
PLAY [client, client2] *********************************************************
[0;36mskipping: no hosts matched[0m

PLAY RECAP *********************************************************************
[0;33mns01[0m                       : [0;32mok=9   [0m [0;33mchanged=7   [0m unreachable=0    failed=0    skipped=0    rescued=0    ignored=0   
[0m[0m
[0m[1m==> ns02: Importing base box 'centos/7'...[0m
[0m[K[0m[0mProgress: 20%[0m[0m[K[0m[0mProgress: 40%[0m[0m[K[0m[0mProgress: 70%[0m[0m[K[0m[0mProgress: 90%[0m[0m[K[0m[1m==> ns02: Matching MAC address for NAT networking...[0m
[1m==> ns02: Checking if box 'centos/7' version '2004.01' is up to date...[0m
[1m==> ns02: Setting the name of the VM: 35_ns02_1695557828535_79577[0m
[1m==> ns02: Fixed port collision for 22 => 2222. Now on port 2200.[0m
[1m==> ns02: Clearing any previously set network interfaces...[0m
[1m==> ns02: Preparing network interfaces based on configuration...[0m
[0m    ns02: Adapter 1: nat[0m
[0m    ns02: Adapter 2: intnet[0m
[1m==> ns02: Forwarding ports...[0m
[0m    ns02: 22 (guest) => 2200 (host) (adapter 1)[0m
[1m==> ns02: Running 'pre-boot' VM customizations...[0m
[1m==> ns02: Booting VM...[0m
[1m==> ns02: Waiting for machine to boot. This may take a few minutes...[0m
[0m    ns02: SSH address: 127.0.0.1:2200[0m
[0m    ns02: SSH username: vagrant[0m
[0m    ns02: SSH auth method: private key[0m
[0m    ns02: 
    ns02: Vagrant insecure key detected. Vagrant will automatically replace
    ns02: this with a newly generated keypair for better security.[0m
[0m    ns02: 
    ns02: Inserting generated public key within guest...[0m
[0m    ns02: Removing insecure key from the guest if it's present...[0m
[0m    ns02: Key inserted! Disconnecting and reconnecting using new SSH key...[0m
[1m==> ns02: Machine booted and ready![0m
[1m==> ns02: Checking for guest additions in VM...[0m
[0m    ns02: No guest additions were detected on the base box for this VM! Guest
    ns02: additions are required for forwarded ports, shared folders, host only
    ns02: networking, and more. If SSH fails on this machine, please install
    ns02: the guest additions and repackage the box to continue.
    ns02: 
    ns02: This is not an error message; everything may continue to work properly,
    ns02: in which case you may ignore this message.[0m
[1m==> ns02: Setting hostname...[0m
[1m==> ns02: Configuring and enabling network interfaces...[0m
[1m==> ns02: Rsyncing folder: /home/zoid/projects/otus/2023-04-linux/35/ => /vagrant[0m
[1m==> ns02: Running provisioner: ansible...[0m
[0m    ns02: Running ansible-playbook...[0m
[0m
PLAY [all] *********************************************************************
[0m[0m
TASK [Gathering Facts] *********************************************************
[0m[0m[0;32mok: [ns02][0m
[0m[0m
TASK [install packages] ********************************************************
[0m[0m[0;33mchanged: [ns02] => (item=bind)[0m
[0m[0m[0;33mchanged: [ns02] => (item=bind-utils)[0m
[0m[0m[0;33mchanged: [ns02] => (item=ntp)[0m
[0m[0m[0;33mchanged: [ns02] => (item=vim)[0m
[0m[0m
TASK [copy transferkey to all servers and the client] **************************
[0m[0m[0;33mchanged: [ns02][0m
[0m[0m
PLAY [ns01] ********************************************************************
[0;36mskipping: no hosts matched[0m
[0m[0m
PLAY [ns02] ********************************************************************
[0m[0m
TASK [Gathering Facts] *********************************************************
[0m[0m[0;32mok: [ns02][0m
[0m[0m
TASK [copy named.conf] *********************************************************
[0m[0m[0;33mchanged: [ns02][0m
[0m[0m
TASK [copy resolv.conf to the servers] *****************************************
[0m[0m[0;33mchanged: [ns02][0m
[0m[0m
TASK [set /etc/named permissions] **********************************************
[0m[0m[0;33mchanged: [ns02][0m
[0m[0m
TASK [set /etc/named permissions] **********************************************
[0m[0m[0;32mok: [ns02][0m
[0m[0m
TASK [ensure named is running and enabled] *************************************
[0m[0m[0;33mchanged: [ns02][0m
[0m[0m[1;35m[WARNING]: Could not match supplied host pattern, ignoring: client[0m
[0m[0m[1;35m[WARNING]: Could not match supplied host pattern, ignoring: client2[0m
[0m[0m
PLAY [client, client2] *********************************************************
[0;36mskipping: no hosts matched[0m

PLAY RECAP *********************************************************************
[0m[0m[0;33mns02[0m                       : [0;32mok=9   [0m [0;33mchanged=6   [0m unreachable=0    failed=0    skipped=0    rescued=0    ignored=0   

[0m[1m==> client: Importing base box 'centos/7'...[0m
[0m[K[0m[0mProgress: 20%[0m[0m[K[0m[0mProgress: 40%[0m[0m[K[0m[0mProgress: 70%[0m[0m[K[0m[0mProgress: 90%[0m[0m[K[0m[1m==> client: Matching MAC address for NAT networking...[0m
[1m==> client: Checking if box 'centos/7' version '2004.01' is up to date...[0m
[1m==> client: Setting the name of the VM: 35_client_1695557927624_31931[0m
[1m==> client: Fixed port collision for 22 => 2222. Now on port 2201.[0m
[1m==> client: Clearing any previously set network interfaces...[0m
[1m==> client: Preparing network interfaces based on configuration...[0m
[0m    client: Adapter 1: nat[0m
[0m    client: Adapter 2: intnet[0m
[1m==> client: Forwarding ports...[0m
[0m    client: 22 (guest) => 2201 (host) (adapter 1)[0m
[1m==> client: Running 'pre-boot' VM customizations...[0m
[1m==> client: Booting VM...[0m
[1m==> client: Waiting for machine to boot. This may take a few minutes...[0m
[0m    client: SSH address: 127.0.0.1:2201[0m
[0m    client: SSH username: vagrant[0m
[0m    client: SSH auth method: private key[0m
[0m    client: 
    client: Vagrant insecure key detected. Vagrant will automatically replace
    client: this with a newly generated keypair for better security.[0m
[0m    client: 
    client: Inserting generated public key within guest...[0m
[0m    client: Removing insecure key from the guest if it's present...[0m
[0m    client: Key inserted! Disconnecting and reconnecting using new SSH key...[0m
[1m==> client: Machine booted and ready![0m
[1m==> client: Checking for guest additions in VM...[0m
[0m    client: No guest additions were detected on the base box for this VM! Guest
    client: additions are required for forwarded ports, shared folders, host only
    client: networking, and more. If SSH fails on this machine, please install
    client: the guest additions and repackage the box to continue.
    client: 
    client: This is not an error message; everything may continue to work properly,
    client: in which case you may ignore this message.[0m
[1m==> client: Setting hostname...[0m
[1m==> client: Configuring and enabling network interfaces...[0m
[1m==> client: Rsyncing folder: /home/zoid/projects/otus/2023-04-linux/35/ => /vagrant[0m
[1m==> client: Running provisioner: ansible...[0m
[0m    client: Running ansible-playbook...[0m
[0m
PLAY [all] *********************************************************************
[0m[0m
TASK [Gathering Facts] *********************************************************
[0m[0m[0;32mok: [client][0m
[0m[0m
TASK [install packages] ********************************************************
[0m[0m[0;33mchanged: [client] => (item=bind)[0m
[0m[0m[0;33mchanged: [client] => (item=bind-utils)[0m
[0m[0m[0;33mchanged: [client] => (item=ntp)[0m
[0m[0m[0;33mchanged: [client] => (item=vim)[0m
[0m[0m
TASK [copy transferkey to all servers and the client] **************************
[0m[0m[0;33mchanged: [client][0m
[0m[0m
PLAY [ns01] ********************************************************************
[0;36mskipping: no hosts matched[0m
[0m[0m
PLAY [ns02] ********************************************************************
[0m[0m[0;36mskipping: no hosts matched[0m
[0m[0m[1;35m[WARNING]: Could not match supplied host pattern, ignoring: client2[0m
[0m[0m
PLAY [client, client2] *********************************************************
[0m[0m
TASK [Gathering Facts] *********************************************************
[0m[0m[0;32mok: [client][0m
[0m[0m
TASK [copy resolv.conf to the client] ******************************************
[0m[0m[0;33mchanged: [client][0m
[0m[0m
TASK [copy rndc conf file] *****************************************************
[0m[0m[0;33mchanged: [client][0m
[0m[0m
TASK [copy motd to the client] *************************************************
[0m[0m[0;33mchanged: [client][0m
[0m[0m
PLAY RECAP *********************************************************************
[0;33mclient[0m                     : [0;32mok=7   [0m [0;33mchanged=5   [0m unreachable=0    failed=0    skipped=0    rescued=0    ignored=0   

[0m[1m==> client2: Importing base box 'centos/7'...[0m
[0m[K[0m[0mProgress: 20%[0m[0m[K[0m[0mProgress: 40%[0m[0m[K[0m[0mProgress: 70%[0m[0m[K[0m[0mProgress: 90%[0m[0m[K[0m[1m==> client2: Matching MAC address for NAT networking...[0m
[1m==> client2: Checking if box 'centos/7' version '2004.01' is up to date...[0m
[1m==> client2: Setting the name of the VM: 35_client2_1695558037888_86166[0m
[1m==> client2: Fixed port collision for 22 => 2222. Now on port 2202.[0m
[1m==> client2: Clearing any previously set network interfaces...[0m
[1m==> client2: Preparing network interfaces based on configuration...[0m
[0m    client2: Adapter 1: nat[0m
[0m    client2: Adapter 2: intnet[0m
[1m==> client2: Forwarding ports...[0m
[0m    client2: 22 (guest) => 2202 (host) (adapter 1)[0m
[1m==> client2: Running 'pre-boot' VM customizations...[0m
[1m==> client2: Booting VM...[0m
[1m==> client2: Waiting for machine to boot. This may take a few minutes...[0m
[0m    client2: SSH address: 127.0.0.1:2202[0m
[0m    client2: SSH username: vagrant[0m
[0m    client2: SSH auth method: private key[0m
[0m    client2: 
    client2: Vagrant insecure key detected. Vagrant will automatically replace
    client2: this with a newly generated keypair for better security.[0m
[0m    client2: 
    client2: Inserting generated public key within guest...[0m
[0m    client2: Removing insecure key from the guest if it's present...[0m
[0m    client2: Key inserted! Disconnecting and reconnecting using new SSH key...[0m
[1m==> client2: Machine booted and ready![0m
[1m==> client2: Checking for guest additions in VM...[0m
[0m    client2: No guest additions were detected on the base box for this VM! Guest
    client2: additions are required for forwarded ports, shared folders, host only
    client2: networking, and more. If SSH fails on this machine, please install
    client2: the guest additions and repackage the box to continue.
    client2: 
    client2: This is not an error message; everything may continue to work properly,
    client2: in which case you may ignore this message.[0m
[1m==> client2: Setting hostname...[0m
[1m==> client2: Configuring and enabling network interfaces...[0m
[1m==> client2: Rsyncing folder: /home/zoid/projects/otus/2023-04-linux/35/ => /vagrant[0m
[1m==> client2: Running provisioner: ansible...[0m
[0m    client2: Running ansible-playbook...[0m
[0m
PLAY [all] *********************************************************************
[0m[0m
TASK [Gathering Facts] *********************************************************
[0m[0m[0;32mok: [client2][0m
[0m[0m
TASK [install packages] ********************************************************
[0m[0m[0;33mchanged: [client2] => (item=bind)[0m
[0m[0m[0;33mchanged: [client2] => (item=bind-utils)[0m
[0m[0m[0;33mchanged: [client2] => (item=ntp)[0m
[0m[0m[0;33mchanged: [client2] => (item=vim)[0m
[0m[0m
TASK [copy transferkey to all servers and the client] **************************
[0m[0m[0;33mchanged: [client2][0m
[0m[0m
PLAY [ns01] ********************************************************************
[0;36mskipping: no hosts matched[0m
[0m[0m
PLAY [ns02] ********************************************************************
[0;36mskipping: no hosts matched[0m
[0m[0m
PLAY [client, client2] *********************************************************
[0m[0m
TASK [Gathering Facts] *********************************************************
[0m[0m[0;32mok: [client2][0m
[0m[0m
TASK [copy resolv.conf to the client] ******************************************
[0m[0m[0;33mchanged: [client2][0m
[0m[0m
TASK [copy rndc conf file] *****************************************************
[0m[0m[0;33mchanged: [client2][0m
[0m[0m
TASK [copy motd to the client] *************************************************
[0m[0m[0;33mchanged: [client2][0m
[0m[0m
PLAY RECAP *********************************************************************
[0m[0m[0;33mclient2[0m                    : [0;32mok=7   [0m [0;33mchanged=5   [0m unreachable=0    failed=0    skipped=0    rescued=0    ignored=0   

[0m[?2004h]0;zoid@dll: ~/projects/otus/2023-04-linux/35[01;32mzoid@dll[00m:[01;34m~/projects/otus/2023-04-linux/35[00m$ vagrant ssh client
[?2004lLast login: Sun Sep 24 12:20:24 2023 from 10.0.2.2
### Welcome to the DNS lab! ###

- Use this client to test the enviroment, with dig or nslookup.
    dig @192.168.50.10 ns01.dns.lab
    dig @192.168.50.11 -x 192.168.50.10

- nsupdate is available in the ddns.lab zone. Ex:
    nsupdate -k /etc/named.zonetransfer.key
    server 192.168.50.10
    zone ddns.lab 
    update add www.ddns.lab. 60 A 192.168.50.15
    send

- rndc is also available to manage the servers
    rndc -c ~/rndc.conf reload

Enjoy!
]0;vagrant@client:~[?1034h[vagrant@client ~]$ ping www.newdns.lab
PING www.newdns.lab (192.168.50.15) 56(84) bytes of data.
64 bytes from client (192.168.50.15): icmp_seq=1 ttl=64 time=0.010 ms
64 bytes from client (192.168.50.15): icmp_seq=2 ttl=64 time=0.045 ms
64 bytes from client (192.168.50.15): icmp_seq=3 ttl=64 time=0.047 ms
64 bytes from client (192.168.50.15): icmp_seq=4 ttl=64 time=0.045 ms
^C
--- www.newdns.lab ping statistics ---
4 packets transmitted, 4 received, 0% packet loss, time 3002ms
rtt min/avg/max/mdev = 0.010/0.036/0.047/0.017 ms
]0;vagrant@client:~[vagrant@client ~]$ ping web1.dns.lab
PING web1.dns.lab (192.168.50.15) 56(84) bytes of data.
64 bytes from client (192.168.50.15): icmp_seq=1 ttl=64 time=0.010 ms
64 bytes from client (192.168.50.15): icmp_seq=2 ttl=64 time=0.048 ms
64 bytes from client (192.168.50.15): icmp_seq=3 ttl=64 time=0.047 ms
64 bytes from client (192.168.50.15): icmp_seq=4 ttl=64 time=0.046 ms
64 bytes from client (192.168.50.15): icmp_seq=5 ttl=64 time=0.084 ms
^C
--- web1.dns.lab ping statistics ---
5 packets transmitted, 5 received, 0% packet loss, time 4001ms
rtt min/avg/max/mdev = 0.010/0.047/0.084/0.023 ms
]0;vagrant@client:~[vagrant@client ~]$ ping web2.dns.lab
ping: web2.dns.lab: Name or service not known
]0;vagrant@client:~[vagrant@client ~]$ 
]0;vagrant@client:~[vagrant@client ~]$ 
]0;vagrant@client:~[vagrant@client ~]$ 
]0;vagrant@client:~[vagrant@client ~]$ 
]0;vagrant@client:~[vagrant@client ~]$ logout
[?2004h]0;zoid@dll: ~/projects/otus/2023-04-linux/35[01;32mzoid@dll[00m:[01;34m~/projects/otus/2023-04-linux/35[00m$ vagrant ssh client2
[?2004lLast login: Sun Sep 24 12:22:13 2023 from 10.0.2.2
### Welcome to the DNS lab! ###

- Use this client to test the enviroment, with dig or nslookup.
    dig @192.168.50.10 ns01.dns.lab
    dig @192.168.50.11 -x 192.168.50.10

- nsupdate is available in the ddns.lab zone. Ex:
    nsupdate -k /etc/named.zonetransfer.key
    server 192.168.50.10
    zone ddns.lab 
    update add www.ddns.lab. 60 A 192.168.50.15
    send

- rndc is also available to manage the servers
    rndc -c ~/rndc.conf reload

Enjoy!
]0;vagrant@client2:~[?1034h[vagrant@client2 ~]$ ping www.newdns.lab
ping: www.newdns.lab: Name or service not known
]0;vagrant@client2:~[vagrant@client2 ~]$ 
]0;vagrant@client2:~[vagrant@client2 ~]$ 
]0;vagrant@client2:~[vagrant@client2 ~]$ 
]0;vagrant@client2:~[vagrant@client2 ~]$ 
]0;vagrant@client2:~[vagrant@client2 ~]$ ping web1.dns.lab
PING web1.dns.lab (192.168.50.15) 56(84) bytes of data.
64 bytes from 192.168.50.15 (192.168.50.15): icmp_seq=1 ttl=64 time=0.784 ms
64 bytes from 192.168.50.15 (192.168.50.15): icmp_seq=2 ttl=64 time=0.879 ms
64 bytes from 192.168.50.15 (192.168.50.15): icmp_seq=3 ttl=64 time=0.954 ms
64 bytes from 192.168.50.15 (192.168.50.15): icmp_seq=4 ttl=64 time=0.948 ms
^C
--- web1.dns.lab ping statistics ---
4 packets transmitted, 4 received, 0% packet loss, time 3006ms
rtt min/avg/max/mdev = 0.784/0.891/0.954/0.071 ms
]0;vagrant@client2:~[vagrant@client2 ~]$ ping web2.dns.lab
PING web2.dns.lab (192.168.50.16) 56(84) bytes of data.
64 bytes from client2 (192.168.50.16): icmp_seq=1 ttl=64 time=0.032 ms
64 bytes from client2 (192.168.50.16): icmp_seq=2 ttl=64 time=0.046 ms
64 bytes from client2 (192.168.50.16): icmp_seq=3 ttl=64 time=0.046 ms
^C
--- web2.dns.lab ping statistics ---
3 packets transmitted, 3 received, 0% packet loss, time 2001ms
rtt min/avg/max/mdev = 0.032/0.041/0.046/0.008 ms
]0;vagrant@client2:~[vagrant@client2 ~]$ logout
[?2004h]0;zoid@dll: ~/projects/otus/2023-04-linux/35[01;32mzoid@dll[00m:[01;34m~/projects/otus/2023-04-linux/35[00m$ [?2004l
exit

Script done on 2023-09-24 15:23:43+03:00 [COMMAND_EXIT_CODE="0"]
